<?xml version="1.0" encoding="UTF-8"?>
<ObservationModel name="KinectOM.xml" xmlns:xsi="http://www.w3.org/2001/XMLSchema-instance"
         xsi:noNamespaceSchemaLocation="src\\schemas\\LoadDataModel.xsd">

	<EspObservation name="observacion1">

		<Properties>
			<EspProperty name="prop11" type="1" />
			<EspProperty name="prop12" type="1" />
			<EspProperty name="prop13" type="1" />
			<EspProperty name="prop14" type="1" />
			<EspProperty name="prop15" type="0" />
		</Properties>
		
	</EspObservation>

	<EspObservation name="observacion2">

		<Properties>
			<EspProperty name="prop21" type="1" />
			<EspProperty name="prop22" type="0" />
		</Properties>

	</EspObservation>
	
</ObservationModel>
