<?xml version="1.0" encoding="UTF-8"?>
<ObservationModel name="KinectOM.xml" xmlns:xsi="http://www.w3.org/2001/XMLSchema-instance"
         xsi:noNamespaceSchemaLocation="LoadDataModel.xsd">

	<EspObservation name="Axis">
		<InputData>
			<IData id="Skeleton" />
			<IData id="TrackingState" />
			<IData id="FinKinect" />
			<IData id="Train" />
			<IData id="Save" />
			<IData id="SituacionSaque"/>
		</InputData>

		<Properties>
			<EspProperty name="Matrix" type="string" />
			<EspProperty name="Matrix2" type="string" />
			<EspProperty name="Matrix3" type="string" />
			<EspProperty name="Matrix4" type="string" />
			<EspProperty name="Matrix5" type="string" />
			<EspProperty name="Matrix6" type="string" />
			<EspProperty name="Matrix7" type="string" />
		</Properties>
		
	</EspObservation>

	<EspObservation name="Axis2">
		<InputData>
			<IData id="Skeleton" />
			<IData id="TrackingState" />
			<IData id="FinKinect" />
			<IData id="Train" />
			<IData id="Save" />
			<IData id="SituacionSaque"/>
		</InputData>

		<Properties>
			<EspProperty name="Matrix" type="string" />
			<EspProperty name="Matrix2" type="string" />
			<EspProperty name="Matrix3" type="string" />
			<EspProperty name="Matrix4" type="string" />
			<EspProperty name="Matrix5" type="string" />
			<EspProperty name="Matrix6" type="string" />
			<EspProperty name="Matrix7" type="string" />
		</Properties>

	</EspObservation>
	
</ObservationModel>